<?xml version="1.0"?>
<!DOCTYPE graph SYSTEM "waypoints.dtd">
<graph>
<listwp>
<wp id="8" x="37.6147" y="201.37" z="-89.9059"/>
<wp id="9" x="83.6971" y="40.1792" z="-47.9067"/>
<wp id="10" x="-5.87117" y="-69.2491" z="-25.7303"/>
<wp id="11" x="-1.04158" y="65.2657" z="-108.622"/>
</listwp>
<listlnk>
<lnk from="8" to="9" coef="1"/>
<lnk from="8" to="10" coef="1"/>
<lnk from="9" to="8" coef="1"/>
<lnk from="9" to="10" coef="1"/>
<lnk from="9" to="11" coef="1"/>
<lnk from="10" to="9" coef="1"/>
<lnk from="10" to="11" coef="3"/>
<lnk from="11" to="8" coef="1"/>
<lnk from="11" to="10" coef="3"/>
</listlnk>
</graph>
